A1: MA | B1: MA | C1: EVNC | D1: SWVA | E1: EM | F1: EA | G1: SE | H1: WC | I1: DV
A2: Largest | B2: 0.91935483870967738 | C2: 0.66129032258064513 | D2: 0.5423728813559322 | E2: 0.64784946236559138 | F2: 0.50510752688172045 | G2: 0.52740112994350286 | H2: 0.38383838383838381 | I2: 0.26822916666666669
A3: Least Large | B3: 0.70149253731343286 | C3: 0.4925373134328358 | D3: 0.41428571428571431 | E3: 0.40641025641025641 | F3: 0.34435028248587568 | G3: 0.37380952380952381 | H3: 0.28645833333333331 | I3: 0.25661375661375663
A4: Average | B4: 0.67502382886565548 | C4: 0.44679773350053409 | D4: 0.41823717916594605 | E4: 0.40808678792749215 | F4: 0.37481933193723588 | G4: 0.35509537487742621 | H4: 0.23038926572214377 | I4: =(I2+I3+I5+I6)/4 -> 0.24787739748677248
A5: Greatest Small | B5: 0.60655737704918034 | C5: 0.44262295081967212 | D5: 0.40909090909090912 | E5: 0.36344086021505373 | F5: 0.32738095238095238 | G5: 0.30508474576271188 | H5: 0.18461538461538463 | I5: 0.24126984126984125
A6: Smallest | B6: 0.44615384615384618 | C6: 0.296875 | D6: 0.265625 | E6: 0.23724747474747473 | F6: 0.20502645502645503 | G6: 0.18857142857142856 | H6: 0.10606060606060606 | I6: 0.22539682539682537
A8: EVNC | B8: MA | C8: EVNC | D8: SWVA | E8: EM | F8: EA | G8: SE | H8: WC | I8: DV
A9: Largest | B9: 0.5757575757575758 | C9: 0.87671232876712324 | D9: 0.82432432432432434 | E9: 0.50578703703703698 | F9: 0.50347222222222232 | G9: 0.48661616161616161 | H9: 0.41106770833333334 | I9: 0.38372747747747749
A10: Least Large | B10: 0.41333333333333333 | C10: 0.76056338028169013 | D10: 0.67567567567567566 | E10: 0.36187214611872148 | F10: 0.369424882629108 | G10: 0.32657657657657657 | H10: 0.32828638497652585 | I10: 0.21684272300469482
A11: Average | B11: 0.40107640963238672 | C11: 0.70688504818564424 | D11: 0.65705843943078568 | E11: 0.35529162681483079 | F11: 0.37982207593067979 | G11: 0.33176461538531155 | H11: 0.30139818922401213 | I11: =(I9+I10+I12+I13)/4 -> 0.29167558844055325
A12: Greatest Small | B12: 0.3888888888888889 | C12: 0.65714285714285714 | D12: 0.63888888888888884 | E12: 0.2759114583333333 | F12: 0.37369791666666669 | G12: 0.2878787878787879 | H12: 0.28997747747747749 | I12: 0.37376126126126125
A13: Smallest | B13: 0.25675675675675674 | C13: 0.45333333333333331 | D13: 0.44 | E13: 0.15011737089201876 | F13: 0.22417840375586853 | G13: 0.19189189189189187 | H13: 0.19538288288288289 | I13: 0.19237089201877935
A15: SWVA | B15: MA | C15: EVNC | D15: SWVA | E15: EM | F15: EA | G15: SE | H15: WC | I15: DV
A16: Largest | B16: 0.50724637681159424 | C16: 0.84057971014492749 | D16: 0.90540540540540537 | E16: 0.46735159817351601 | F16: 0.47009132420091321 | G16: 0.49474885844748862 | H16: 0.46002252252252257 | I16: 0.46480855855855852
A17: Least Large | B17: 0.39189189189189189 | C17: 0.72463768115942029 | D17: 0.73611111111111116 | E17: 0.37922705314009664 | F17: 0.38112745098039219 | G17: 0.37962962962962965 | H17: 0.34085648148148151 | I17: 0.29716435185185186
A18: Average | B18: 0.37795924899517153 | C18: 0.66159481060521663 | D18: 0.74061004991487212 | E18: 0.33175908321722097 | F18: 0.35825448697619561 | G18: 0.34547761423598322 | H18: 0.33721421217255698 | I18: =(I16+I17+I19+I20)/4 -> 0.36776463963963962
A19: Greatest Small | B19: 0.36231884057971014 | C19: 0.61643835616438358 | D19: 0.69565217391304346 | E19: 0.28490338164251205 | F19: 0.3216324200913242 | G19: 0.30724637681159417 | H19: 0.31700450450450451 | I19: 0.43605324074074076
A20: Smallest | B20: 0.22972972972972974 | C20: 0.41891891891891891 | D20: 0.53246753246753242 | E20: 0.16192129629629629 | F20: 0.23826291079812204 | G20: 0.23687214611872148 | H20: 0.19444444444444445 | I20: 0.27303240740740736
A22: EM | B22: MA | C22: EVNC | D22: SWVA | E22: EM | F22: EA | G22: SE | H22: WC | I22: DV
A23: Largest | B23: 0.57358191193970653 | C23: 0.52433371958285047 | D23: 0.46811932812184365 | E23: 0.80882352941176472 | F23: 0.64544591777229787 | G23: 0.62550221367911896 | H23: 0.52143684820393965 | I23: 0.46078431372549017
A24: Least Large | B24: 0.40636782572266444 | C24: 0.34387713328822483 | D24: 0.3380281690140845 | E24: 0.60913280268118974 | F24: 0.48114615992934895 | G24: 0.46082949308755761 | H24: 0.29729121961817134 | I24: 0.27165665875343292
A25: Average | B25: 0.38126535899933567 | C25: 0.36843097776729228 | D25: 0.34224386720843025 | E25: 0.59584710146516273 | F25: 0.4886200619616935 | G25: 0.42687316625435007 | H25: 0.30496409603019453 | I25: =(I23+I24+I26+I27)/4 -> 0.33952033892735978
A26: Greatest Small | B26: 0.34782608695652173 | C26: 0.323943661971831 | D26: 0.34462912920352634 | E26: 0.51487504958349872 | F26: 0.47887323943661969 | G26: 0.38235294117647056 | H26: 0.3186558516801854 | I26: 0.40686274509803921
A27: Smallest | B27: 0.21126760563380281 | C27: 0.18644292220247544 | D27: 0.20393561232311427 | E27: 0.28081357203111823 | F27: 0.28820740441844045 | G27: 0.26336216792739559 | H27: 0.16630013454333401 | I27: 0.21877763813247683
A29: EA | B29: MA | C29: EVNC | D29: SWVA | E29: EM | F29: EA | G29: SE | H29: WC | I29: DV
A30: Largest | B30: 0.51183368827017606 | C30: 0.54081907882818514 | D30: 0.49734099299117157 | E30: 0.65390087182117118 | F30: 0.82420301779870209 | G30: 0.54956703072853985 | H30: 0.44413495017409055 | I30: 0.41529686156358853
A31: Least Large | B31: 0.36080776816518412 | C31: 0.38175249154938595 | D31: 0.34742257641480889 | E31: 0.52739094660389385 | F31: 0.63684051245838802 | G31: 0.40010888326600308 | H31: 0.3460703349726269 | I31: 0.21137607868609076
A32: Average | B32: 0.33812089813456198 | C32: 0.38069020275807625 | D32: 0.35728246040289457 | E32: 0.47168869945436698 | F32: 0.64410468937334653 | G32: 0.36138699861255508 | H32: 0.31246225026733121 | I32: =(I30+I31+I33+I34)/4 -> 0.3104842443921792
A33: Greatest Small | B33: 0.29444325908510838 | C33: 0.35241404020112643 | D33: 0.35241404020112643 | E33: 0.36790512115490681 | F33: 0.55906096316229015 | G33: 0.33671708267606942 | H33: 0.29352863489014291 | I33: 0.40771091492876188
A34: Smallest | B34: 0.18763240189649955 | C34: 0.231211540401493 | D34: 0.24573791990315746 | E34: 0.2205437505799388 | F34: 0.3919548990289794 | G34: 0.24549464554166334 | H34: 0.18439268813213328 | I34: 0.2075531223902756
A36: SE | B36: MA | C36: EVNC | D36: SWVA | E36: EM | F36: EA | G36: SE | H36: WC | I36: DV
A37: Largest | B37: 0.51986596457635237 | C37: 0.51428571428571423 | D37: 0.52433973601538908 | E37: 0.6572847682119205 | F37: 0.57858823529411763 | G37: 0.81043561512685491 | H37: 0.6327171021215634 | I37: 0.46666666666666662
A38: Least Large | B38: 0.32539736680537545 | C38: 0.32539736680537545 | D38: 0.37144416399481539 | E38: 0.46468646864686469 | F38: 0.40555290265365979 | G38: 0.53891807080974141 | H38: 0.42964705882352938 | I38: 0.34975369458128081
A39: Average | B39: 0.36271763653681283 | C39: 0.37621925561740749 | D39: 0.38941907556563327 | E39: 0.46571096321287281 | F39: 0.40947752849839686 | G39: 0.6066155841299421 | H39: 0.42153823651141414 | I39: =(I37+I38+I40+I41)/4 -> 0.38189207923497465
A40: Greatest Small | B40: 0.35858823529411765 | C40: 0.35858823529411765 | D40: 0.3936782420383193 | E40: 0.39058823529411768 | F40: 0.3583529411764706 | G40: 0.51685460473185174 | H40: 0.35927152317880795 | I40: 0.41225165562913901
A41: Smallest | B41: 0.20260590763353567 | C41: 0.21795484003001564 | D41: 0.26821192052980131 | E41: 0.2594542843465773 | F41: 0.27466960352422909 | G41: 0.36009933774834435 | H41: 0.23378823529411766 | I41: 0.29889630006281215
A43: WC | B43: MA | C43: EVNC | D43: SWVA | E43: EM | F43: EA | G43: SE | H43: WC | I43: DV
A44: Largest | B44: 0.38898515181403776 | C44: 0.47076347512816952 | D44: 0.49314762816817598 | E44: 0.55276837363047471 | F44: 0.48006644518272423 | G44: 0.65321093781009909 | H44: 0.84964488426607043 | I44: 0.52756822403868353
A45: Least Large | B45: 0.21786470400154925 | C45: 0.3724137931034483 | D45: 0.37580071174377222 | E45: 0.33115435008235489 | F45: 0.35372251097140422 | G45: 0.46510079772775176 | H45: 0.55560478511298184 | I45: 0.40762073548958799
A46: Average | B46: 0.22309176984890877 | C46: 0.32540663946587867 | D46: 0.3618517945532555 | E46: 0.31637065106009754 | F46: 0.33630134607775641 | G46: 0.40267318098032701 | H46: 0.59190707688901656 | I46: =(I44+I45+I47+I48)/4 -> 0.41989385020440284
A47: Greatest Small | B47: 0.25079305840641908 | C47: 0.3356344118248672 | D47: 0.3828883767278598 | E47: 0.30039875941515287 | F47: 0.31719758984084306 | G47: 0.36059065900766712 | H47: 0.51661129568106312 | I47: 0.46531667384747949
A48: Smallest | B48: 0.10167019520072298 | C48: 0.21176470588235294 | D48: 0.21724137931034485 | E48: 0.17138690048121877 | F48: 0.19559408981472423 | G48: 0.20043552768142534 | H48: 0.2561790917662804 | I48: 0.27906976744186041
A50: DV | B50: MA | C50: EVNC | D50: SWVA | E50: EM | F50: EA | G50: SE | H50: WC | I50: DV
A51: Largest | B51: 0.38253824788721252 | C51: 0.43162221181313798 | D51: 0.52282338349485735 | E51: 0.48831115983640699 | F51: 0.46569754794637658 | G51: 0.49760847622000703 | H51: 0.59564445793227205 | I51: 0.75261011622281782
A52: Least Large | B52: 0.37714244898003352 | C52: 0.43103849454708371 | D52: 0.50896048813799988 | E52: 0.42286098814463946 | F52: 0.44287062021282919 | G52: 0.4415579636818574 | H52: 0.49174730330378419
A53: Average | B53: 0.30133511159693044 | C53: 0.34415600857301609 | D53: 0.41709762913059367 | E53: 0.36840016826616467 | F53: 0.32978263551789716 | G53: 0.38419378454845959 | H53: 0.43642616272110252 | I53: 0.7433330372903082
A54: Greatest Small | B54: 0.24573649036463321 | C54: 0.23401967316941225 | D54: 0.32522084485113184 | E54: 0.30316850306439058 | F54: 0.24207766008911241 | G54: 0.32975979205288408 | H54: 0.38844943494065731
A55: Smallest | B55: 0.22129846179820148 | C55: 0.21285691249251892 | D55: 0.29077890608343493 | E55: 0.23813639272448989 | F55: 0.24045864478120035 | G55: 0.27037308401181376 | H55: 0.27012957778184216 | I55: 0.73405595835779847